{
  "name": "sap-hana-cli",
  "description": "Assists with SAP HANA Developer CLI (hana-cli) for database development and administration. Use when: installing hana-cli, connecting to SAP HANA databases, inspecting database objects (tables, views, procedures, functions), managing HDI containers, executing SQL queries, converting metadata to CDS/EDMX/OpenAPI formats, managing SAP HANA Cloud instances, working with BTP CLI integration, or troubleshooting hana-cli commands. Covers: 91 commands, 17+ output formats, HDI container management, cloud operations.",
  "version": "2.1.4",
  "author": {
    "name": "E.J.",
    "email": "maintainers@example.com"
  },
  "license": "GPL-3.0",
  "repository": "https://github.com/secondsky/sap-skills",
  "keywords": [
    "api",
    "btp",
    "cds",
    "cli",
    "cloud",
    "database",
    "hana",
    "hdi",
    "sap",
    "sap-hana-cli",
    "sql",
    "sqlscript"
  ],
  "category": "hana"
}
