{
  "name": "sap-sac-custom-widget",
  "description": "SAP Analytics Cloud (SAC) Custom Widget development skill. Use when building custom visualizations, interactive components, extending SAC with Web Components, or creating Widget Add-Ons to customize built-in widgets. Covers JSON metadata configuration, JavaScript Web Components, lifecycle functions, data binding with feeds, styling panels, builder panels, property/event/method definitions, custom types, script API data types, third-party library integration, hosting options, security, performance optimization, and debugging. Includes Widget Add-On feature (QRC Q4 2023+) for extending built-in widgets without creating from scratch. Provides templates for basic widgets, data-bound charts, styling panels, and KPI cards. Supports Optimized Story Experience and Analytics Designer. Prevents common errors: missing lifecycle functions, incorrect JSON schema, integrity warnings, CORS failures, property type mismatches, data binding issues, and performance anti-patterns. Keywords: sap analytics cloud, sac custom widget, custom widget development, web component sac, json metadata widget, widget lifecycle functions, onCustomWidgetBeforeUpdate, onCustomWidgetAfterUpdate, onCustomWidgetResize, onCustomWidgetDestroy, sac data binding, widget data binding, dataBindings feeds, getDataBinding, getResultSet, styling panel widget, builder panel widget, widget properties events methods, propertiesChanged event, dispatchEvent custom widget, sac echarts integration, sac d3js integration, third party library sac, widget hosting sac, sac hosted widget, integrity hash widget, sha256 integrity, widget security cors, sac widget debugging, custom visualization sac, sac analytics designer widget, optimized story experience widget, sac widget api, widget add-on, sac script api widget, custom types enumeration, MemberInfo ResultMemberInfo Selection, widget installation admin, sac performance optimization, shadow dom web component, sac tooltip customization, plot area addon",
  "version": "2.1.4",
  "author": {
    "name": "E.J.",
    "email": "maintainers@example.com"
  },
  "license": "GPL-3.0",
  "repository": "https://github.com/secondsky/sap-skills",
  "keywords": [
    "analytics",
    "api",
    "custom",
    "dashboard",
    "data",
    "javascript",
    "json",
    "sac",
    "sap",
    "sap-sac-custom-widget",
    "visualization",
    "widget"
  ],
  "category": "data-analytics",
  "agents": [
    "./agents/widget-debugger.md",
    "./agents/widget-architect.md",
    "./agents/widget-api-assistant.md"
  ],
  "commands": [
    "./commands/widget-validate.md",
    "./commands/widget-lint.md",
    "./commands/widget-generate.md"
  ]
}
