{
  "name": "sap-btp-cloud-transport-management",
  "description": "Comprehensive skill for SAP Cloud Transport Management service on SAP BTP. Use when setting up transport landscapes, configuring transport nodes and routes, managing import queues, deploying MTAs across Cloud Foundry environments, integrating with CI/CD pipelines, configuring ABAP environment transports, troubleshooting deployment errors, or implementing change management workflows. Covers entitlements, subscriptions, role collections, service instances, destinations, and API integrations.",
  "version": "2.1.4",
  "author": {
    "name": "E.J.",
    "email": "maintainers@example.com"
  },
  "license": "GPL-3.0",
  "repository": "https://github.com/secondsky/sap-skills",
  "keywords": [
    "abap",
    "api",
    "btp",
    "cap",
    "cloud",
    "cloud foundry",
    "cloud platform",
    "deployment",
    "kyma",
    "management",
    "sap",
    "sap-btp-cloud-transport-management",
    "transport"
  ],
  "category": "btp"
}
