{
  "name": "sapui5-cli",
  "description": "Manages SAPUI5/OpenUI5 projects using the UI5 Tooling CLI (@ui5/cli). Use when initializing UI5 projects, configuring ui5.yaml or ui5-workspace.yaml files, building UI5 applications or libraries, running development servers with HTTP/2 support, creating custom build tasks or server middleware, managing workspace/monorepo setups, troubleshooting UI5 CLI errors, migrating between UI5 CLI versions, or optimizing build performance. Supports both OpenUI5 and SAPUI5 frameworks with complete configuration and extensibility guidance.",
  "version": "2.2.3",
  "author": {
    "name": "E.J.",
    "email": "maintainers@example.com"
  },
  "license": "GPL-3.0",
  "repository": "https://github.com/secondsky/sap-skills",
  "keywords": [
    "cli",
    "components",
    "fiori",
    "frontend",
    "http",
    "mvc",
    "sapui5",
    "sapui5-cli",
    "yaml"
  ],
  "category": "ui-development"
}
