{
  "name": "sap-sac-scripting",
  "description": "Comprehensive SAC scripting skill for SAP Analytics Cloud Analytics Designer and Optimized Story Experience. This skill should be used when the user asks to \"create SAC script\", \"debug Analytics Designer\", \"optimize SAC performance\", \"planning operations in SAC\", \"filter data in SAC\", \"use DataSource API\", \"chart scripting\", \"table manipulation\", \"SAC event handlers\", \"version management\", \"data locking\", \"Optimized Story Experience API\", \"OSE scripting\", \"OSE widget API\", \"OSE DataSource\", \"story scripting API\", \"OSE planning API\", \"OSE method\", \"optimized story\", \"SAC story scripting\", \"story script\", \"SAC scripting\", or works with SAC widgets, planning models, or analytics applications.",
  "version": "2.2.1",
  "author": {
    "name": "E.J.",
    "email": "maintainers@example.com"
  },
  "license": "GPL-3.0",
  "repository": "https://github.com/secondsky/sap-skills",
  "keywords": [
    "analytics",
    "api",
    "dashboard",
    "data",
    "sac",
    "sap",
    "sap-sac-scripting",
    "scripting",
    "visualization"
  ],
  "category": "data-analytics",
  "agents": [
    "./agents/sac-api-helper.md",
    "./agents/sac-planning-assistant.md",
    "./agents/sac-performance-optimizer.md",
    "./agents/sac-script-debugger.md"
  ],
  "commands": [
    "./commands/sac-optimize.md",
    "./commands/sac-debug.md",
    "./commands/sac-script-template.md",
    "./commands/sac-planning.md"
  ]
}
